{
  "profile": "bwg-worker-possession/0.2",
  "proofProfile": "bwg-worker-possession-proof/0.2",
  "fixtureIdentity": {
    "classification": "non_production_conformance_only",
    "publicJwk": {
      "kty": "OKP",
      "crv": "Ed25519",
      "x": "11qYAYKxCrfVS_7TyWQHOg7hcvPapiMlrwIaaPcHURo",
      "alg": "Ed25519",
      "use": "sig",
      "key_ops": [
        "verify"
      ]
    },
    "fingerprintSha256": "hY0InB-Rsm_aD1yTwooBeb9rZ70sRetubQskIJmm490"
  },
  "initialAdmission": {
    "request": {
      "profile": "bwg-worker-possession/0.2",
      "requestId": "pos_initial_01",
      "command": "prove_possession",
      "payload": {
        "possessionNonce": "AQEBAQEBAQEBAQEBAQEBAQEBAQEBAQEBAQEBAQEBAQE",
        "challengeBindingSha256": "X4zZvQZS4kl8eriGLhoxvxVwcFz5Tx40nnKDBbgLW6k",
        "controllerCapabilitySha256": "lBT4OBpPbcqrqBGc7gUBSDjLPCFS8fVZru63sNOSdL0",
        "sessionId": "AgICAgICAgICAgICAgICAg",
        "hostNonce": "AwMDAwMDAwMDAwMDAwMDAwMDAwMDAwMDAwMDAwMDAwM",
        "deviceNonce": "BAQEBAQEBAQEBAQEBAQEBAQEBAQEBAQEBAQEBAQEBAQ",
        "serialManifestSha256": "PcDZyHEt43VSeh_GLDmyZJtkMxRrRyh0Vr2xCr-vVUc",
        "purpose": "initial_admission"
      }
    },
    "response": {
      "profile": "bwg-worker-possession/0.2",
      "requestId": "pos_initial_01",
      "ok": true,
      "result": {
        "claims": {
          "profile": "bwg-worker-possession-proof/0.2",
          "possessionNonce": "AQEBAQEBAQEBAQEBAQEBAQEBAQEBAQEBAQEBAQEBAQE",
          "challengeBindingSha256": "X4zZvQZS4kl8eriGLhoxvxVwcFz5Tx40nnKDBbgLW6k",
          "controllerCapabilitySha256": "lBT4OBpPbcqrqBGc7gUBSDjLPCFS8fVZru63sNOSdL0",
          "sessionId": "AgICAgICAgICAgICAgICAg",
          "hostNonce": "AwMDAwMDAwMDAwMDAwMDAwMDAwMDAwMDAwMDAwMDAwM",
          "deviceNonce": "BAQEBAQEBAQEBAQEBAQEBAQEBAQEBAQEBAQEBAQEBAQ",
          "serialManifestSha256": "PcDZyHEt43VSeh_GLDmyZJtkMxRrRyh0Vr2xCr-vVUc",
          "purpose": "initial_admission",
          "firmwareSourceCommit": "aaaaaaaaaaaaaaaaaaaaaaaaaaaaaaaaaaaaaaaa",
          "appElfSha256": "bbbbbbbbbbbbbbbbbbbbbbbbbbbbbbbbbbbbbbbbbbbbbbbbbbbbbbbbbbbbbbbb",
          "deviceIdentityJwk": {
            "kty": "OKP",
            "crv": "Ed25519",
            "x": "11qYAYKxCrfVS_7TyWQHOg7hcvPapiMlrwIaaPcHURo",
            "alg": "Ed25519",
            "use": "sig",
            "key_ops": [
              "verify"
            ]
          }
        },
        "compactJws": "eyJhbGciOiJFZDI1NTE5IiwidHlwIjoiYndnLXdvcmtlci1wb3NzZXNzaW9uK2p3cyJ9.eyJhcHBFbGZTaGEyNTYiOiJiYmJiYmJiYmJiYmJiYmJiYmJiYmJiYmJiYmJiYmJiYmJiYmJiYmJiYmJiYmJiYmJiYmJiYmJiYmJiYmJiYmJiIiwiY2hhbGxlbmdlQmluZGluZ1NoYTI1NiI6Ilg0elp2UVpTNGtsOGVyaUdMaG94dnhWd2NGejVUeDQwbm5LREJiZ0xXNmsiLCJjb250cm9sbGVyQ2FwYWJpbGl0eVNoYTI1NiI6ImxCVDRPQnBQYmNxcnFCR2M3Z1VCU0RqTFBDRlM4ZlZacnU2M3NOT1NkTDAiLCJkZXZpY2VJZGVudGl0eUp3ayI6eyJhbGciOiJFZDI1NTE5IiwiY3J2IjoiRWQyNTUxOSIsImtleV9vcHMiOlsidmVyaWZ5Il0sImt0eSI6Ik9LUCIsInVzZSI6InNpZyIsIngiOiIxMXFZQVlLeENyZlZTXzdUeVdRSE9nN2hjdlBhcGlNbHJ3SWFhUGNIVVJvIn0sImRldmljZU5vbmNlIjoiQkFRRUJBUUVCQVFFQkFRRUJBUUVCQVFFQkFRRUJBUUVCQVFFQkFRRUJBUSIsImZpcm13YXJlU291cmNlQ29tbWl0IjoiYWFhYWFhYWFhYWFhYWFhYWFhYWFhYWFhYWFhYWFhYWFhYWFhYWFhYSIsImhvc3ROb25jZSI6IkF3TURBd01EQXdNREF3TURBd01EQXdNREF3TURBd01EQXdNREF3TURBd00iLCJwb3NzZXNzaW9uTm9uY2UiOiJBUUVCQVFFQkFRRUJBUUVCQVFFQkFRRUJBUUVCQVFFQkFRRUJBUUVCQVFFIiwicHJvZmlsZSI6ImJ3Zy13b3JrZXItcG9zc2Vzc2lvbi1wcm9vZi8wLjIiLCJwdXJwb3NlIjoiaW5pdGlhbF9hZG1pc3Npb24iLCJzZXJpYWxNYW5pZmVzdFNoYTI1NiI6IlBjRFp5SEV0NDNWU2VoX0dMRG15Wkp0a014UnJSeWgwVnIyeENyLXZWVWMiLCJzZXNzaW9uSWQiOiJBZ0lDQWdJQ0FnSUNBZ0lDQWdJQ0FnIn0.kafh4HlbfvIUtENilUWQad_XmpaDd-kozANleQ_7yYW-n8B5uInX6KeJuweN-EsWsOqXzrJjqp-YX8ODoWnuAA"
      }
    }
  },
  "reacquisition": {
    "request": {
      "profile": "bwg-worker-possession/0.2",
      "requestId": "pos_reacquire_01",
      "command": "prove_possession",
      "payload": {
        "possessionNonce": "AQEBAQEBAQEBAQEBAQEBAQEBAQEBAQEBAQEBAQEBAQE",
        "challengeBindingSha256": "X4zZvQZS4kl8eriGLhoxvxVwcFz5Tx40nnKDBbgLW6k",
        "controllerCapabilitySha256": "lBT4OBpPbcqrqBGc7gUBSDjLPCFS8fVZru63sNOSdL0",
        "sessionId": "AgICAgICAgICAgICAgICAg",
        "hostNonce": "AwMDAwMDAwMDAwMDAwMDAwMDAwMDAwMDAwMDAwMDAwM",
        "deviceNonce": "BAQEBAQEBAQEBAQEBAQEBAQEBAQEBAQEBAQEBAQEBAQ",
        "serialManifestSha256": "PcDZyHEt43VSeh_GLDmyZJtkMxRrRyh0Vr2xCr-vVUc",
        "purpose": "transport_reacquisition"
      }
    },
    "response": {
      "profile": "bwg-worker-possession/0.2",
      "requestId": "pos_reacquire_01",
      "ok": true,
      "result": {
        "claims": {
          "profile": "bwg-worker-possession-proof/0.2",
          "possessionNonce": "AQEBAQEBAQEBAQEBAQEBAQEBAQEBAQEBAQEBAQEBAQE",
          "challengeBindingSha256": "X4zZvQZS4kl8eriGLhoxvxVwcFz5Tx40nnKDBbgLW6k",
          "controllerCapabilitySha256": "lBT4OBpPbcqrqBGc7gUBSDjLPCFS8fVZru63sNOSdL0",
          "sessionId": "AgICAgICAgICAgICAgICAg",
          "hostNonce": "AwMDAwMDAwMDAwMDAwMDAwMDAwMDAwMDAwMDAwMDAwM",
          "deviceNonce": "BAQEBAQEBAQEBAQEBAQEBAQEBAQEBAQEBAQEBAQEBAQ",
          "serialManifestSha256": "PcDZyHEt43VSeh_GLDmyZJtkMxRrRyh0Vr2xCr-vVUc",
          "purpose": "transport_reacquisition",
          "firmwareSourceCommit": "aaaaaaaaaaaaaaaaaaaaaaaaaaaaaaaaaaaaaaaa",
          "appElfSha256": "bbbbbbbbbbbbbbbbbbbbbbbbbbbbbbbbbbbbbbbbbbbbbbbbbbbbbbbbbbbbbbbb",
          "deviceIdentityJwk": {
            "kty": "OKP",
            "crv": "Ed25519",
            "x": "11qYAYKxCrfVS_7TyWQHOg7hcvPapiMlrwIaaPcHURo",
            "alg": "Ed25519",
            "use": "sig",
            "key_ops": [
              "verify"
            ]
          }
        },
        "compactJws": "eyJhbGciOiJFZDI1NTE5IiwidHlwIjoiYndnLXdvcmtlci1wb3NzZXNzaW9uK2p3cyJ9.eyJhcHBFbGZTaGEyNTYiOiJiYmJiYmJiYmJiYmJiYmJiYmJiYmJiYmJiYmJiYmJiYmJiYmJiYmJiYmJiYmJiYmJiYmJiYmJiYmJiYmJiYmJiIiwiY2hhbGxlbmdlQmluZGluZ1NoYTI1NiI6Ilg0elp2UVpTNGtsOGVyaUdMaG94dnhWd2NGejVUeDQwbm5LREJiZ0xXNmsiLCJjb250cm9sbGVyQ2FwYWJpbGl0eVNoYTI1NiI6ImxCVDRPQnBQYmNxcnFCR2M3Z1VCU0RqTFBDRlM4ZlZacnU2M3NOT1NkTDAiLCJkZXZpY2VJZGVudGl0eUp3ayI6eyJhbGciOiJFZDI1NTE5IiwiY3J2IjoiRWQyNTUxOSIsImtleV9vcHMiOlsidmVyaWZ5Il0sImt0eSI6Ik9LUCIsInVzZSI6InNpZyIsIngiOiIxMXFZQVlLeENyZlZTXzdUeVdRSE9nN2hjdlBhcGlNbHJ3SWFhUGNIVVJvIn0sImRldmljZU5vbmNlIjoiQkFRRUJBUUVCQVFFQkFRRUJBUUVCQVFFQkFRRUJBUUVCQVFFQkFRRUJBUSIsImZpcm13YXJlU291cmNlQ29tbWl0IjoiYWFhYWFhYWFhYWFhYWFhYWFhYWFhYWFhYWFhYWFhYWFhYWFhYWFhYSIsImhvc3ROb25jZSI6IkF3TURBd01EQXdNREF3TURBd01EQXdNREF3TURBd01EQXdNREF3TURBd00iLCJwb3NzZXNzaW9uTm9uY2UiOiJBUUVCQVFFQkFRRUJBUUVCQVFFQkFRRUJBUUVCQVFFQkFRRUJBUUVCQVFFIiwicHJvZmlsZSI6ImJ3Zy13b3JrZXItcG9zc2Vzc2lvbi1wcm9vZi8wLjIiLCJwdXJwb3NlIjoidHJhbnNwb3J0X3JlYWNxdWlzaXRpb24iLCJzZXJpYWxNYW5pZmVzdFNoYTI1NiI6IlBjRFp5SEV0NDNWU2VoX0dMRG15Wkp0a014UnJSeWgwVnIyeENyLXZWVWMiLCJzZXNzaW9uSWQiOiJBZ0lDQWdJQ0FnSUNBZ0lDQWdJQ0FnIn0.Lj3oe57CZAknU_MfS8MAaMyJEBFeV59Kp3nfpyugPHeFXstEU08CwZESH7aPduAjKEuiiauY6ec1KhDvLyYyCw"
      }
    }
  },
  "controlSessionBindingSha256": "ale6owHYgI2vTKsXVH1JJY25j5HC6W9BH-slwQ9rvC8",
  "weakKeyForgery": {
    "profile": "bwg-worker-possession/0.2",
    "requestId": "pos_initial_01",
    "ok": true,
    "result": {
      "claims": {
        "profile": "bwg-worker-possession-proof/0.2",
        "possessionNonce": "AQEBAQEBAQEBAQEBAQEBAQEBAQEBAQEBAQEBAQEBAQE",
        "challengeBindingSha256": "X4zZvQZS4kl8eriGLhoxvxVwcFz5Tx40nnKDBbgLW6k",
        "controllerCapabilitySha256": "CtvT6G8qseRHNbuD5QCpkgeLQXK6RZfJTBqv9XKjm8U",
        "sessionId": "AgICAgICAgICAgICAgICAg",
        "hostNonce": "AwMDAwMDAwMDAwMDAwMDAwMDAwMDAwMDAwMDAwMDAwM",
        "deviceNonce": "BAQEBAQEBAQEBAQEBAQEBAQEBAQEBAQEBAQEBAQEBAQ",
        "serialManifestSha256": "ff749MMrgnM5q2-PIXvDEZPt3ScoBjbCwOi-XNj1fok",
        "purpose": "initial_admission",
        "firmwareSourceCommit": "aaaaaaaaaaaaaaaaaaaaaaaaaaaaaaaaaaaaaaaa",
        "appElfSha256": "bbbbbbbbbbbbbbbbbbbbbbbbbbbbbbbbbbbbbbbbbbbbbbbbbbbbbbbbbbbbbbbb",
        "deviceIdentityJwk": {
          "kty": "OKP",
          "crv": "Ed25519",
          "x": "AQAAAAAAAAAAAAAAAAAAAAAAAAAAAAAAAAAAAAAAAAA",
          "alg": "Ed25519",
          "use": "sig",
          "key_ops": [
            "verify"
          ]
        }
      },
      "compactJws": "eyJhbGciOiJFZDI1NTE5IiwidHlwIjoiYndnLXdvcmtlci1wb3NzZXNzaW9uK2p3cyJ9.eyJhcHBsaWNhdGlvbkRlc2NyaXB0b3JTaGEyNTYiOiJyT0tPXzd3aFpmeTBudE1LTTlSSWVaTkFBM3g5N3R0M3JXTUFtX1FzaFZBIiwiY2hhbGxlbmdlQmluZGluZ1NoYTI1NiI6IkNDQ0NDQ0NDQ0NDQ0NDQ0NDQ0NDQ0NDQ0NDQ0NDQ0NDQ0NDQ0NDQ0NDQ0MiLCJjb250cm9sbGVyQ2FwYWJpbGl0eVNoYTI1NiI6IkpGV3N5dWVIdlhTOU05R2xEbEs2eUVPd1V6TzhvUFh0bG9hbHlUUnhGdkUiLCJkZXZpY2VJZGVudGl0eUp3ayI6eyJhbGciOiJFZDI1NTE5IiwiY3J2IjoiRWQyNTUxOSIsImtleV9vcHMiOlsidmVyaWZ5Il0sImt0eSI6Ik9LUCIsInVzZSI6InNpZyIsIngiOiJBUUFBQUFBQUFBQUFBQUFBQUFBQUFBQUFBQUFBQUFBQUFBQUFBQUFBQUFBIn0sInBvc3Nlc3Npb25Ob25jZSI6IkJCQkJCQkJCQkJCQkJCQkJCQkJCQkJCQkJCQkJCQkJCQkJCQkJCQkJCQkIiLCJwcm9maWxlIjoiYndnLXdvcmtlci1wb3NzZXNzaW9uLXByb29mLzAuMSIsInB1cnBvc2UiOiJpbml0aWFsX2FkbWlzc2lvbiJ9.WGZmZmZmZmZmZmZmZmZmZmZmZmZmZmZmZmZmZmZmZmYBAAAAAAAAAAAAAAAAAAAAAAAAAAAAAAAAAAAAAAAAAA"
    }
  },
  "nonCanonicalWeakKeyForgery": {
    "profile": "bwg-worker-possession/0.2",
    "requestId": "pos_initial_01",
    "ok": true,
    "result": {
      "claims": {
        "profile": "bwg-worker-possession-proof/0.2",
        "possessionNonce": "AQEBAQEBAQEBAQEBAQEBAQEBAQEBAQEBAQEBAQEBAQE",
        "challengeBindingSha256": "X4zZvQZS4kl8eriGLhoxvxVwcFz5Tx40nnKDBbgLW6k",
        "controllerCapabilitySha256": "CtvT6G8qseRHNbuD5QCpkgeLQXK6RZfJTBqv9XKjm8U",
        "sessionId": "AgICAgICAgICAgICAgICAg",
        "hostNonce": "AwMDAwMDAwMDAwMDAwMDAwMDAwMDAwMDAwMDAwMDAwM",
        "deviceNonce": "BAQEBAQEBAQEBAQEBAQEBAQEBAQEBAQEBAQEBAQEBAQ",
        "serialManifestSha256": "ff749MMrgnM5q2-PIXvDEZPt3ScoBjbCwOi-XNj1fok",
        "purpose": "initial_admission",
        "firmwareSourceCommit": "aaaaaaaaaaaaaaaaaaaaaaaaaaaaaaaaaaaaaaaa",